<?xml version="1.0" encoding="ISO-8859-1" standalone="no"?>
<FAQ xmlns:xsi="http://www.w3.org/2001/XMLSchema-instance" xsi:noNamespaceSchemaLocation="foro.xsd">
	<INFO>
		<TITULO>WINDOWS98? SOLO SI ME OBLIGAN!</TITULO>
		<AUTOR>Fernando Lorenzo García</AUTOR>
		<EMAIL>Fer@yahoo.es</EMAIL>
		<VERSION>1.0</VERSION>
		<FECHA>1999-05-20</FECHA>
	</INFO>
	<PART NO="P1" TITLE="W95">
		<Q N="1">
			<QTEXT>¿Por qué tengo que instalar W95?</QTEXT>
			<A>A mí también me parece una buena pregunta.</A>
			<A>Y a mí ...</A>
		</Q>
		<Q N="2">
			<QTEXT>¿Y de que me vale?</QTEXT>
			<A>Otra ingeniosa pregunta.</A>
		</Q>
	</PART>
	<PART NO="P2" TITLE="DOS">
		<Q N="1">
			<QTEXT>¿Puedo mantener DOS y W95?</QTEXT>
			<A>Pues si.</A>
		</Q>
		<Q N="2">
			<QTEXT>¿Tengo que cambiar de ordenador?</QTEXT>
			<A>Depende....</A>
		</Q>
		<Q N="3">
			<QTEXT>¿De qué depende?</QTEXT>
		</Q>
	</PART>
</FAQ>